id,match_id,sender,message,seen,notified,revealed,timestamp
885,319,candidate,"Hi there! Yes, till getting to understand it myself! I am still interested in the role!",1,0,0,2025-04-08 15:18:27
898,319,candidate,"I've just revealed who I am in the Room, I am *, a * at .",1,0,1,2025-04-08 16:28:41
920,319,company,Hey *,1,0,0,2025-04-09 10:25:24
921,319,company,Would you be free for a quick chat today after 4.30?,1,0,0,2025-04-09 10:25:40
922,319,company,or tomorrow?,1,0,0,2025-04-09 10:26:00
923,319,company,feel free to drop me an email,1,0,0,2025-04-09 10:26:06
924,319,company,*,1,0,0,2025-04-09 10:26:14
993,12678,company,"Hi,",1,1,0,2025-04-13 20:32:47
994,12678,company,Thank you for your interest in this role is there any information you would like to know more about us?,1,1,0,2025-04-13 20:33:37
2085,12852,candidate,g\'day,1,0,0,2025-05-28 12:20:19
2506,13204,candidate,"Hey * team, apologies for the late response…very late response. My * interface wasn’t working on my iPhone 11…I’m the old school type…are you still keen to talk?",1,0,0,2025-06-05 20:18:42
2543,13204,candidate,"Afternoon, any update for me?",1,0,0,2025-06-09 11:15:47
2720,13204,company,"Hi *, apologies for the also very late response back. This position is still open and we\'d like to arrange an initial Teams call (just an informal chat) to see what it is you\'re looking for, tell you more about the role etc. Are you still searching and available this Wednesday at all?",1,0,0,2025-06-16 13:10:55
2782,13204,candidate,"Good afternoon, great herring from you and an initial call sounds great. I’m fully booked Wednesday yet will be able to move my 9am so would 9am work? My email address is *@gmail.com 🙏",1,0,0,2025-06-17 12:01:13
2797,13204,company,"Hi * , happy to do 9am if you get around to reading this now. Alternatively, does a quick 15 minute chat on Friday work for you at all?",1,0,0,2025-06-17 17:10:54
2899,13204,candidate,"Hey, sorry for missing this I only got a chat notification. 20 minutes ago.",1,0,0,2025-06-20 13:22:34
2900,13204,candidate,I can’t do today I’m,1,0,0,2025-06-20 13:22:55
2901,13204,candidate,Back,1,0,0,2025-06-20 13:22:58
2902,13204,candidate,To back in meetings. Can we do 4pm on Monday l?,1,0,0,2025-06-20 13:23:43
2930,13204,company,"Hi *. Sorry I\'m unable to do that time, how is your schedule looking tomorrow afternoon?",1,0,0,2025-06-23 12:04:54
3017,13204,candidate,"Hey, can you manage next Monday at 1pm?",1,0,0,2025-06-25 09:54:24
3020,13204,company,"1pm on Monday works. I\'ll send across an invite shortly. As mentioned, just a 15 informal chat",1,0,0,2025-06-25 10:17:35
3082,13204,candidate,Fantastic sounds good! my email address is:,1,0,0,2025-06-27 10:27:26
3083,13204,candidate,*@gmail.com,1,0,0,2025-06-27 10:27:28